{
  "schema": "vibe22.day_ahead_tariff_forecast.v1",
  "version": "1.0.0",
  "source": "fixture:illustrative_evening_tou",
  "generated_at": "2026-08-21T00:00:00Z",
  "timezone": "America/Chicago",
  "effective_start": "2025-12-15T00:00:00-06:00",
  "interval_minutes": 60,
  "currency": "USD",
  "energy_price_unit": "USD_per_kWh",
  "energy_prices": [
    0.0825,
    0.0825,
    0.0825,
    0.0825,
    0.0825,
    0.0825,
    0.0825,
    0.0825,
    0.0825,
    0.0825,
    0.0825,
    0.0825,
    0.0825,
    0.0825,
    0.0825,
    0.0825,
    0.165,
    0.165,
    0.165,
    0.165,
    0.165,
    0.0825,
    0.0825,
    0.0825
  ],
  "demand_rate_usd_per_kw": 12.0,
  "month_to_date_peak_kw": 0.0,
  "ratchet_floor_kw": 0.0,
  "contract_demand_floor_kw": 0.0,
  "verified_tariff": false,
  "freshness_seconds": 3600,
  "missing_interval_policy": "fail_closed",
  "banner": "ILLUSTRATIVE TARIFF \u2014 NOT VERIFIED UTILITY PRICING",
  "provenance": {
    "hash": "81e0d434b04f6e0dd2598300d793ee7532328cdb29e7efeef6990ed40be9e244",
    "notes": "local fixture; no commercial API"
  }
}